{
  "updated": "2026-09-29",
  "repository": "Ridd1kulusC0d3r/RedFrameworks",
  "schema_version": "2.0",
  "frameworks": [
    {
      "id": "ptes",
      "name": "Penetration Testing Execution Standard",
      "type": "methodology",
      "domain": [
        "enterprise"
      ],
      "status": "verified",
      "url": "https://www.pentest-standard.org/",
      "best_for": [
        "penetration testing lifecycle",
        "engagement structure"
      ]
    },
    {
      "id": "nist-sp-800-115",
      "name": "NIST SP 800-115",
      "type": "assessment-guidance",
      "domain": [
        "enterprise"
      ],
      "status": "verified",
      "url": "https://csrc.nist.gov/pubs/sp/800/115/final",
      "best_for": [
        "formal security assessment programs",
        "planning and reporting"
      ]
    },
    {
      "id": "owasp-wstg",
      "name": "OWASP Web Security Testing Guide",
      "type": "domain-testing-guide",
      "domain": [
        "web"
      ],
      "status": "verified",
      "url": "https://wstg.owasp.org/",
      "best_for": [
        "web application testing",
        "web service testing"
      ]
    },
    {
      "id": "owasp-mastg",
      "name": "OWASP Mobile Application Security Testing Guide",
      "type": "domain-testing-guide",
      "domain": [
        "mobile"
      ],
      "status": "verified",
      "url": "https://mas.owasp.org/MASTG/",
      "best_for": [
        "mobile application security testing"
      ]
    },
    {
      "id": "owasp-iot-istg",
      "name": "OWASP IoT Security Testing Guide",
      "type": "domain-testing-guide",
      "domain": [
        "iot",
        "embedded"
      ],
      "status": "verified",
      "url": "https://owasp.org/projects/iot-security-testing-guide",
      "best_for": [
        "IoT penetration testing methodology",
        "IoT test cases"
      ]
    },
    {
      "id": "mitre-attack",
      "name": "MITRE ATT&CK",
      "type": "knowledge-base",
      "domain": [
        "enterprise",
        "cloud",
        "mobile"
      ],
      "status": "verified",
      "url": "https://attack.mitre.org/",
      "best_for": [
        "TTP mapping",
        "threat-informed testing",
        "detection engineering"
      ]
    },
    {
      "id": "mitre-atlas",
      "name": "MITRE ATLAS",
      "type": "knowledge-base",
      "domain": [
        "ai-genai"
      ],
      "status": "verified",
      "url": "https://atlas.mitre.org/",
      "best_for": [
        "AI adversary behavior modeling",
        "AI threat-informed testing"
      ]
    },
    {
      "id": "mitre-d3fend",
      "name": "MITRE D3FEND",
      "type": "defensive-knowledge-base",
      "domain": [
        "enterprise",
        "detection"
      ],
      "status": "verified",
      "url": "https://d3fend.mitre.org/",
      "best_for": [
        "countermeasure mapping",
        "purple-team analysis"
      ]
    },
    {
      "id": "attack-flow",
      "name": "Attack Flow",
      "type": "behavior-model",
      "domain": [
        "enterprise",
        "cloud"
      ],
      "status": "verified",
      "url": "https://attackflow.org/",
      "best_for": [
        "multi-step attack paths",
        "behavior sequencing"
      ]
    },
    {
      "id": "ctid-adversary-emulation",
      "name": "CTID Adversary Emulation Library",
      "type": "emulation-library",
      "domain": [
        "enterprise"
      ],
      "status": "verified",
      "url": "https://ctid.mitre.org/resources/adversary-emulation-library/",
      "best_for": [
        "intelligence-driven emulation",
        "full and micro emulation plans"
      ]
    },
    {
      "id": "tiber-eu",
      "name": "TIBER-EU",
      "type": "threat-led-testing-framework",
      "domain": [
        "regulated",
        "financial"
      ],
      "status": "verified",
      "url": "https://www.ecb.europa.eu/paym/cyber-resilience/tiber-eu/html/index.en.html",
      "best_for": [
        "threat-intelligence-based ethical red teaming",
        "DORA-aligned TLPT"
      ]
    },
    {
      "id": "cbest",
      "name": "CBEST",
      "type": "threat-led-testing-framework",
      "domain": [
        "regulated",
        "financial",
        "uk"
      ],
      "status": "verified",
      "url": "https://www.bankofengland.co.uk/financial-stability/operational-resilience-of-the-financial-sector/cbest-threat-intelligence-led-assessments-implementation-guide",
      "best_for": [
        "UK financial-sector intelligence-led testing",
        "regulator-led resilience assessment"
      ]
    },
    {
      "id": "crest-tlpt",
      "name": "CREST Threat-Led Penetration Testing",
      "type": "assurance-framework",
      "domain": [
        "enterprise",
        "regulated"
      ],
      "status": "verified",
      "url": "https://www.crest-approved.org/cyber-service-categories/red-teaming/",
      "best_for": [
        "threat-led assurance",
        "provider and service quality structure"
      ]
    },
    {
      "id": "mitre-engage",
      "name": "MITRE Engage",
      "type": "adversary-engagement-framework",
      "domain": [
        "enterprise",
        "deception"
      ],
      "status": "verified",
      "url": "https://engage.mitre.org/",
      "best_for": [
        "adversary engagement planning",
        "deception and denial concepts"
      ]
    },
    {
      "id": "owasp-genai",
      "name": "OWASP GenAI Security Project",
      "type": "application-security-guidance",
      "domain": [
        "ai-genai"
      ],
      "status": "verified",
      "url": "https://genai.owasp.org/",
      "best_for": [
        "GenAI application risk modeling",
        "LLM risk mitigation"
      ]
    },
    {
      "id": "nist-ai-rmf-genai",
      "name": "NIST AI RMF Generative AI Profile",
      "type": "risk-management-guidance",
      "domain": [
        "ai-genai"
      ],
      "status": "verified",
      "url": "https://www.nist.gov/publications/artificial-intelligence-risk-management-framework-generative-artificial-intelligence",
      "best_for": [
        "AI governance",
        "GenAI risk management"
      ]
    },
    {
      "id": "atomic-red-team",
      "name": "Atomic Red Team",
      "type": "control-validation",
      "domain": [
        "enterprise",
        "detection"
      ],
      "status": "verified",
      "url": "https://github.com/redcanaryco/atomic-red-team",
      "best_for": [
        "portable ATT&CK-mapped tests",
        "detection validation"
      ]
    },
    {
      "id": "mitre-caldera",
      "name": "MITRE CALDERA",
      "type": "emulation-automation",
      "domain": [
        "enterprise"
      ],
      "status": "verified",
      "url": "https://caldera.mitre.org/",
      "best_for": [
        "automated adversary emulation",
        "repeatable assessment workflows"
      ]
    },
    {
      "id": "owasp-asvs",
      "name": "OWASP Application Security Verification Standard",
      "type": "application-security-standard",
      "domain": [
        "web",
        "application-security",
        "secure-development"
      ],
      "status": "verified",
      "version": "5.0.0",
      "url": "https://owasp.org/www-project-application-security-verification-standard/",
      "best_for": [
        "application security requirements",
        "technical control verification",
        "security testing baselines"
      ],
      "evidence_tier": "A",
      "last_reviewed": "2026-09-29"
    },
    {
      "id": "owasp-samm",
      "name": "OWASP Software Assurance Maturity Model",
      "type": "software-security-maturity-model",
      "domain": [
        "application-security",
        "secure-development",
        "governance"
      ],
      "status": "verified",
      "version": "2.2.0",
      "url": "https://owasp.org/www-project-samm/",
      "best_for": [
        "software security maturity assessment",
        "secure SDLC improvement",
        "program measurement"
      ],
      "evidence_tier": "A",
      "last_reviewed": "2026-09-29"
    },
    {
      "id": "owasp-api-top10",
      "name": "OWASP API Security Top 10",
      "type": "application-risk-framework",
      "domain": [
        "api",
        "web",
        "application-security"
      ],
      "status": "verified",
      "version": "2023",
      "url": "https://owasp.org/www-project-api-security/",
      "best_for": [
        "API risk awareness",
        "API assessment scoping",
        "API security requirements"
      ],
      "evidence_tier": "A",
      "last_reviewed": "2026-09-29"
    },
    {
      "id": "owasp-masvs",
      "name": "OWASP Mobile Application Security Verification Standard",
      "type": "mobile-security-standard",
      "domain": [
        "mobile",
        "android",
        "ios"
      ],
      "status": "verified",
      "version": "2.1.0",
      "url": "https://mas.owasp.org/MASVS/",
      "best_for": [
        "mobile security requirements",
        "mobile application assurance",
        "mobile assessment criteria"
      ],
      "evidence_tier": "A",
      "last_reviewed": "2026-09-29"
    },
    {
      "id": "owasp-isvs",
      "name": "OWASP IoT Security Verification Standard",
      "type": "iot-security-standard",
      "domain": [
        "iot",
        "embedded",
        "product-security"
      ],
      "status": "verified",
      "url": "https://owasp.org/www-project-iot-security-verification-standard/",
      "best_for": [
        "IoT security requirements",
        "embedded-system assurance",
        "IoT product testing scope"
      ],
      "evidence_tier": "A",
      "last_reviewed": "2026-09-29"
    },
    {
      "id": "nist-csf-2",
      "name": "NIST Cybersecurity Framework 2.0",
      "type": "cybersecurity-risk-framework",
      "domain": [
        "enterprise",
        "governance",
        "risk-management"
      ],
      "status": "verified",
      "version": "2.0",
      "url": "https://www.nist.gov/cyberframework",